{
  "operation": "plate.parse",
  "description": "Parse a standard licence plate as of a given date.",
  "rule": "vehicles.plates",
  "inputs": {
    "plate": "plate as typed",
    "date": "date of the check (ISO), because codes 59–69 start on 2027-01-01"
  },
  "outputs": {
    "serial": "serial as written",
    "category": "vehicle category 1–9",
    "year": "two-digit year as written",
    "wilaya": "wilaya code",
    "category_name": "French name of the category (rule vehicles.plates, categories)"
  },
  "cases": [
    {
      "id": "blida-2026",
      "input": {
        "plate": "02639-126-09",
        "date": "2026-10-28"
      },
      "expected": {
        "serial": "02639",
        "category": 1,
        "year": "26",
        "wilaya": 9
      },
      "source": "wikipedia-plates"
    },
    {
      "id": "bouira-2025",
      "input": {
        "plate": "76739-125-10",
        "date": "2026-10-28"
      },
      "expected": {
        "serial": "76739",
        "category": 1,
        "year": "25",
        "wilaya": 10
      },
      "source": "wikipedia-plates"
    },
    {
      "id": "spaces",
      "input": {
        "plate": "12345 119 16",
        "date": "2026-10-28"
      },
      "expected": {
        "serial": "12345",
        "category": 1,
        "year": "19",
        "wilaya": 16
      }
    },
    {
      "id": "no-separators",
      "input": {
        "plate": "1234511916",
        "date": "2026-10-28"
      },
      "expected": {
        "serial": "12345",
        "category": 1,
        "year": "19",
        "wilaya": 16
      }
    },
    {
      "id": "motorcycle",
      "input": {
        "plate": "15843-919-16",
        "date": "2026-10-28"
      },
      "expected": {
        "serial": "15843",
        "category": 9,
        "year": "19",
        "wilaya": 16
      }
    },
    {
      "id": "unknown-year",
      "input": {
        "plate": "12345-133-16",
        "date": "2026-10-28"
      },
      "expected": {
        "serial": "12345",
        "category": 1,
        "year": "33",
        "wilaya": 16
      },
      "source": "arrete-plates-2023"
    },
    {
      "id": "new-wilaya-before-2027",
      "input": {
        "plate": "12345-127-64",
        "date": "2026-10-28"
      },
      "expected": null,
      "source": "arrete-plates-2026"
    },
    {
      "id": "new-wilaya-after-2027",
      "input": {
        "plate": "12345-127-64",
        "date": "2027-06-01"
      },
      "expected": {
        "serial": "12345",
        "category": 1,
        "year": "27",
        "wilaya": 64
      },
      "source": "arrete-plates-2026"
    },
    {
      "id": "code-69-after-2027",
      "input": {
        "plate": "00412-127-69",
        "date": "2027-06-01"
      },
      "expected": {
        "serial": "00412",
        "category": 1,
        "year": "27",
        "wilaya": 69
      },
      "source": "arrete-plates-2026"
    },
    {
      "id": "code-70",
      "input": {
        "plate": "12345-126-70",
        "date": "2027-06-01"
      },
      "expected": null
    },
    {
      "id": "category-0",
      "input": {
        "plate": "12345-026-16",
        "date": "2027-06-01"
      },
      "expected": null
    },
    {
      "id": "serial-zero",
      "input": {
        "plate": "00000-126-16",
        "date": "2027-06-01"
      },
      "expected": null
    },
    {
      "id": "serial-too-long",
      "input": {
        "plate": "1234567-126-16",
        "date": "2027-06-01"
      },
      "expected": null
    },
    {
      "id": "middle-two-digits",
      "input": {
        "plate": "06390-00-09",
        "date": "2027-06-01"
      },
      "expected": null
    },
    {
      "id": "arabic-indic-digits",
      "input": {
        "plate": "٠٢٦٣٩-١٢٦-٠٩",
        "date": "2026-10-28"
      },
      "expected": {
        "serial": "02639",
        "category": 1,
        "year": "26",
        "wilaya": 9
      }
    },
    {
      "id": "spaced-dashes",
      "input": {
        "plate": "02639 - 126 - 09",
        "date": "2026-10-28"
      },
      "expected": {
        "serial": "02639",
        "category": 1,
        "year": "26",
        "wilaya": 9
      }
    },
    {
      "id": "compact-with-space",
      "input": {
        "plate": "12345 11916",
        "date": "2026-10-28"
      },
      "expected": {
        "serial": "12345",
        "category": 1,
        "year": "19",
        "wilaya": 16
      }
    },
    {
      "id": "compact-six-digit-serial",
      "input": {
        "plate": "12345611916",
        "date": "2026-10-28"
      },
      "expected": {
        "serial": "123456",
        "category": 1,
        "year": "19",
        "wilaya": 16
      }
    },
    {
      "id": "short-serial",
      "input": {
        "plate": "7-126-31",
        "date": "2026-10-28"
      },
      "expected": {
        "serial": "7",
        "category": 1,
        "year": "26",
        "wilaya": 31
      }
    },
    {
      "id": "code-49-in-2026",
      "input": {
        "plate": "00123-125-49",
        "date": "2026-10-28"
      },
      "expected": {
        "serial": "00123",
        "category": 1,
        "year": "25",
        "wilaya": 49
      }
    },
    {
      "id": "old-plate-2005",
      "input": {
        "plate": "12345-105-16",
        "date": "2005-06-01"
      },
      "expected": {
        "serial": "12345",
        "category": 1,
        "year": "05",
        "wilaya": 16
      },
      "notes": "the first version has no start date"
    },
    {
      "id": "dots",
      "input": {
        "plate": "02639.126.09",
        "date": "2026-10-28"
      },
      "expected": null,
      "notes": "dots are not plate separators"
    },
    {
      "id": "compact-nine-digits",
      "input": {
        "plate": "123411916",
        "date": "2026-10-28"
      },
      "expected": null
    },
    {
      "id": "null",
      "input": {
        "plate": null,
        "date": "2026-10-28"
      },
      "expected": null
    },
    {
      "id": "code-59-last-day-2026",
      "input": {
        "plate": "12345-127-59",
        "date": "2026-12-31"
      },
      "expected": null
    },
    {
      "id": "code-59-first-day-2027",
      "input": {
        "plate": "12345-127-59",
        "date": "2027-01-01"
      },
      "expected": {
        "serial": "12345",
        "category": 1,
        "year": "27",
        "wilaya": 59
      }
    },
    {
      "id": "category-name-car",
      "input": {
        "plate": "02639-126-09",
        "date": "2026-10-28"
      },
      "expected": {
        "serial": "02639",
        "category": 1,
        "category_name": "Véhicule de tourisme",
        "year": "26",
        "wilaya": 9
      }
    },
    {
      "id": "category-name-trailer",
      "input": {
        "plate": "12345-822-16",
        "date": "2026-10-28"
      },
      "expected": {
        "serial": "12345",
        "category": 8,
        "category_name": "Remorque ou semi-remorque",
        "year": "22",
        "wilaya": 16
      }
    },
    {
      "id": "category-name-motorcycle",
      "input": {
        "plate": "12345-925-31",
        "date": "2026-10-28"
      },
      "expected": {
        "serial": "12345",
        "category": 9,
        "category_name": "Motocyclette",
        "year": "25",
        "wilaya": 31
      }
    }
  ]
}
