{
  "operation": "wilaya.lookup",
  "description": "Find a wilaya by its code.",
  "rule": "administrative.wilayas",
  "inputs": {
    "code": "code as number or string"
  },
  "outputs": {
    "name_fr": "French name",
    "name_ar": "Arabic name",
    "parent": "for wilayas created after 1984: code of the wilaya it was created from",
    "valid_from": "for wilayas created after 1984: first day it exists"
  },
  "cases": [
    {
      "id": "alger",
      "input": {
        "code": 16
      },
      "expected": {
        "name_fr": "Alger",
        "name_ar": "الجزائر"
      },
      "source": "wikipedia-provinces"
    },
    {
      "id": "string-code",
      "input": {
        "code": "09"
      },
      "expected": {
        "name_fr": "Blida",
        "name_ar": "البليدة"
      },
      "source": "wikipedia-provinces"
    },
    {
      "id": "code-60",
      "input": {
        "code": 60
      },
      "expected": {
        "name_fr": "Barika",
        "name_ar": "بريكة"
      },
      "source": "decret-presidentiel-26-206"
    },
    {
      "id": "code-64",
      "input": {
        "code": 64
      },
      "expected": {
        "name_fr": "Ksar Chellala",
        "name_ar": "قصر الشلالة"
      },
      "source": "decret-presidentiel-26-206"
    },
    {
      "id": "code-68",
      "input": {
        "code": 68
      },
      "expected": {
        "name_fr": "Bou Saâda",
        "name_ar": "بوسعادة"
      },
      "source": "decret-presidentiel-26-206"
    },
    {
      "id": "code-69",
      "input": {
        "code": 69
      },
      "expected": {
        "name_fr": "El Abiodh Sidi Cheikh",
        "name_ar": "الأبيض سيدي الشيخ"
      },
      "source": "decret-presidentiel-26-206"
    },
    {
      "id": "code-0",
      "input": {
        "code": 0
      },
      "expected": null
    },
    {
      "id": "code-70",
      "input": {
        "code": 70
      },
      "expected": null
    },
    {
      "id": "leading-zeros",
      "input": {
        "code": "016"
      },
      "expected": {
        "name_fr": "Alger",
        "name_ar": "الجزائر"
      }
    },
    {
      "id": "arabic-indic-digits",
      "input": {
        "code": "٠٩"
      },
      "expected": {
        "name_fr": "Blida",
        "name_ar": "البليدة"
      }
    },
    {
      "id": "surrounding-spaces",
      "input": {
        "code": " 9 "
      },
      "expected": {
        "name_fr": "Blida",
        "name_ar": "البليدة"
      }
    },
    {
      "id": "letter-after",
      "input": {
        "code": "16a"
      },
      "expected": null
    },
    {
      "id": "exponent",
      "input": {
        "code": "1e1"
      },
      "expected": null
    },
    {
      "id": "decimal-text",
      "input": {
        "code": "16.0"
      },
      "expected": null
    },
    {
      "id": "decimal-number",
      "input": {
        "code": 16.5
      },
      "expected": null
    },
    {
      "id": "empty",
      "input": {
        "code": ""
      },
      "expected": null
    },
    {
      "id": "null",
      "input": {
        "code": null
      },
      "expected": null
    },
    {
      "id": "code-50-in-2020",
      "input": {
        "code": 50,
        "date": "2020-01-01"
      },
      "expected": {
        "name_fr": "Bordj Badji Mokhtar",
        "name_ar": "برج باجي مختار"
      },
      "source": "decret-presidentiel-21-117"
    },
    {
      "id": "code-50-before-2019-law",
      "input": {
        "code": 50,
        "date": "2019-12-10"
      },
      "expected": null
    },
    {
      "id": "code-60-before-2026-law",
      "input": {
        "code": 60,
        "date": "2026-04-03"
      },
      "expected": null
    },
    {
      "id": "code-60-on-2026-law",
      "input": {
        "code": 60,
        "date": "2026-04-04"
      },
      "expected": {
        "name_fr": "Barika",
        "name_ar": "بريكة"
      },
      "source": "decret-presidentiel-26-206"
    },
    {
      "id": "before-1984",
      "input": {
        "code": 16,
        "date": "1983-12-31"
      },
      "expected": null,
      "notes": "no version: a lookup rejects rather than raising"
    },
    {
      "id": "parent-of-49",
      "input": {
        "code": 49,
        "date": "2026-10-28"
      },
      "expected": {
        "name_fr": "Timimoun",
        "name_ar": "تيميمون",
        "parent": 1,
        "valid_from": "2019-12-11"
      },
      "source": "decret-presidentiel-21-117"
    },
    {
      "id": "parent-of-64",
      "input": {
        "code": 64,
        "date": "2026-10-28"
      },
      "expected": {
        "name_fr": "Ksar Chellala",
        "name_ar": "قصر الشلالة",
        "parent": 14,
        "valid_from": "2026-04-04"
      },
      "source": "decret-presidentiel-26-206"
    }
  ]
}
