{
  "operation": "salary.gross-to-net",
  "description": "Monthly gross-to-net for a regular salary fully subject to CNAS and IRG.",
  "rule": "payroll.irg-salary",
  "inputs": {
    "gross": "monthly gross salary in DA",
    "regime": "salaried, retired or disabled",
    "date": "date the salary relates to (ISO)"
  },
  "outputs": {
    "cnas_employee": "9 % of gross",
    "taxable": "gross minus cnas_employee",
    "irg": "IRG on taxable",
    "net": "taxable minus irg",
    "cnas_employer": "25.5 % of gross (25 % + 0.5 % social services)"
  },
  "cases": [
    {
      "id": "gross-60000",
      "input": {
        "gross": 60000,
        "regime": "salaried",
        "date": "2026-10-28"
      },
      "expected": {
        "cnas_employee": 5400,
        "taxable": 54600,
        "irg": 7042,
        "net": 47558,
        "cnas_employer": 15300
      },
      "source": "upgrowth-salary"
    },
    {
      "id": "minimum-wage",
      "input": {
        "gross": 24000,
        "regime": "salaried",
        "date": "2026-10-28"
      },
      "expected": {
        "cnas_employee": 2160,
        "taxable": 21840,
        "irg": 0,
        "net": 21840,
        "cnas_employer": 6120
      },
      "source": "upgrowth-salary"
    },
    {
      "id": "gross-32967",
      "input": {
        "gross": 32967,
        "regime": "salaried",
        "date": "2026-10-28"
      },
      "expected": {
        "cnas_employee": 2967.03,
        "taxable": 29999.97,
        "irg": 0,
        "net": 29999.97,
        "cnas_employer": 8406.59
      },
      "notes": "taxable 29 999.97: exempt"
    },
    {
      "id": "gross-32968",
      "input": {
        "gross": 32968,
        "regime": "salaried",
        "date": "2026-10-28"
      },
      "expected": {
        "cnas_employee": 2967.12,
        "taxable": 30000.88,
        "irg": 2,
        "net": 29998.88,
        "cnas_employer": 8406.84
      },
      "notes": "taxable 30 000.88: the smoothing starts; net is about 1 DA lower than at 32 967 (the law's formula)"
    },
    {
      "id": "gross-45000",
      "input": {
        "gross": 45000,
        "regime": "salaried",
        "date": "2026-10-28"
      },
      "expected": {
        "cnas_employee": 4050,
        "taxable": 40950,
        "irg": 3356.5,
        "net": 37593.5,
        "cnas_employer": 11475
      }
    },
    {
      "id": "gross-100000",
      "input": {
        "gross": 100000,
        "regime": "salaried",
        "date": "2026-10-28"
      },
      "expected": {
        "cnas_employee": 9000,
        "taxable": 91000,
        "irg": 17200,
        "net": 73800,
        "cnas_employer": 25500
      }
    },
    {
      "id": "gross-250000-55",
      "input": {
        "gross": 250000.55,
        "regime": "salaried",
        "date": "2026-10-28"
      },
      "expected": {
        "cnas_employee": 22500.05,
        "taxable": 227500.5,
        "irg": 60175.1,
        "net": 167325.4,
        "cnas_employer": 63750.14
      },
      "notes": "gross with centimes"
    },
    {
      "id": "retired-40000",
      "input": {
        "gross": 40000,
        "regime": "retired",
        "date": "2026-10-28"
      },
      "expected": {
        "cnas_employee": 3600,
        "taxable": 36400,
        "irg": 1483,
        "net": 34917,
        "cnas_employer": 10200
      }
    },
    {
      "id": "disabled-50000",
      "input": {
        "gross": 50000,
        "regime": "disabled",
        "date": "2026-10-28"
      },
      "expected": {
        "cnas_employee": 4500,
        "taxable": 45500,
        "irg": 4585,
        "net": 40915,
        "cnas_employer": 12750
      }
    },
    {
      "id": "unknown-regime",
      "input": {
        "gross": 60000,
        "regime": "retraite",
        "date": "2026-10-28"
      },
      "error": "invalid-option"
    },
    {
      "id": "negative",
      "input": {
        "gross": -100,
        "regime": "salaried",
        "date": "2026-10-28"
      },
      "error": "invalid-amount"
    },
    {
      "id": "before-2022",
      "input": {
        "gross": 60000,
        "regime": "salaried",
        "date": "2021-06-30"
      },
      "error": "no-rule-for-date"
    }
  ]
}
